index,TEXT,LANG
1132,nhum go hipok piita goja ha axkamur nhum hapex pa ne ken prek ne hkra hixet rorok ne hpigranh pa pika htertet tyx kumrex jakama a memoj amnhi nhipex ane,Apinayé
11090,aꞌeramu ꞌga ꞌjau ajaupe: —simonorog awi itaꞌi ꞌjawewara simomot esaka ee ꞌjau “awyja sipo weroo” ꞌe are ꞌjau— ꞌjau ꞌga ajaupe yma janeruwarete ꞌga kaꞌarana kwasiarukari ꞌga amu upe ꞌga raity are rakue: “jeraitya nipo ꞌga imojoꞌojoꞌoka ajaupe itaꞌi ꞌjawewara nipo ꞌga imomoa jeraityfer are” ꞌjau ꞌga ikwasiaa rakue aꞌeramu jefaruu ꞌga aipo apou ꞌga raityfera mojoꞌokawamu,Kayabí
6481,ijotawece niɡijo noiigi oigidi modita “anikanitoɡodici yakadi moko nilaagetedipi codaa me ɡodionigipi leeɡodi lemeɡegi niɡidoa ɡoneleegiwa”,Kadiwéu
13970,tu xe: —‍'unoy munom xop 'ate xa hapxe'e 'aktux: monayxop hittap namix xok ha no hapkot ha' yog hapkox xip 'uxukpot tu' tu ya' xip honha,Maxakalí
12951,tiise itakon iteꞌkaron yuwaꞌtoꞌ ta teepiremasanon esanon yepotori ewomi eꞌpitiꞌpi tiwin iteꞌka tiwin konoꞌ tiise miikiri ewomi pin min ton pra tiise miikiriya aniꞌri wiisaꞌ tiuya mini yari eꞌpitiꞌpi paapa piꞌ ekaremeꞌse miriri yariiya imakuiꞌpi tinkupiꞌpi ton pe moropai tonpayamiꞌ nikupiꞌpi imakuiꞌpi tinepuꞌtikon pe pra ikuꞌsaꞌ toꞌya ton pe yariꞌpiiya,Macushi
15690,—raketee do jam nꞌaa rabajam noo go ta patug panꞌaa we ne ta yym panꞌaa bahom ajꞌyy najiis jam hꞌyyb mahuum nꞌaa tsebee kan katee do panꞌaa kyyh ha katee do najiis tsebe do hadoo y hyyh —nang ma jowaw —baad y tsebee kan sahonh he rabahom do hyb nꞌaa ta we,Nadëb
20570,niytatsahi atsoko nira peduru niritohoko naha bo inaraha niahatsahi nihyrikosokdatatsa nikozonahaze inury zebykyryknaha iytyk bo ibarikta baze tu nitsahoroknaha sesus tuktsa sizubaretsa ziwabykynaha ananias ioke ahatsa sisoho ziwabykynaha,Rikbaktsa
10326,tai jiary rarybere deuxu tyytybytyhy deewimy boibekemy deobiredyyna iwidyyomy boibeke deobiredyyna dori deuxu tyytybytyhy oluduna‑ki ramyhyre wimy oludurenyre tai aobo adeereny awire iwidyy adeereny isirare,Karajá
6844,paulo iiɡe timoteo me iɡenaɡadi me yeloɡodi aneotedoɡoji lotaɡa eliodi me ɡadajoini lodoe aneotedoɡoji iniaa ǥoniotagodi jesus cristo niɡijoa ane iwi anigoteta inatawece oko niɡina baɡalee newiɡa codaa me niɡijo baanaɡa nigo leeɡodi jesus cristo me dopitedijo odaa iiɡe inatawece niɡina oko ɡadajoini me eloɡoti aneotedoɡoji lotaɡa ele midioka limedi me ɡadigomi meloɡotitedibece lotaɡa aneotedoɡoji niɡina me eni mele codaa niɡina makati me daɡa domeɡele eleditace adinatiita niɡina oko codaa iiɡaxinitece lotaɡa aneotedoɡoji niɡina me enitece libeyaceɡeco oko codaa niɡina mikeenitiogi libeyaceɡeco codaa awii loniciwaɡa moika libeyaceɡeco amanagawini odopitalo aneotedoɡoji igaataɡa icotalo nokododi niɡina oko me daɡaleeɡowajipatalo niɡinoa niiɡaxinaɡaneɡeco anewi pida odioteci niɡica anepaa lidaɡataka lolaadi jeɡepaanaɡa odoletibige niiɡaxinaɡanadi anodiiɡaxinaɡatece aninokina anoyemaa niɡina oko mowajipata oika mowajipata niɡinoa niiɡaxinaɡaneɡeco anewi pida owajipatalo latematiko niɡinoa laxokodi laamipi ane deɡewiteda,Kadiwéu
24812,“chaymari caychu ‘pay cashtam ca’ nil nunacunachu nimacata janay pachachu diospa anjilnincunap nawpaninchu ya'a rasun nunap chulincapis ‘ya'a cashtam pay'a’ nisha,Urubu-Kaapor
24865,tuncurincunapis nichu quichalayacanumi cayan; alluncunapipis articunallam yalayamun; shimincunachupis culibraypa bininuncunallam winalayalcan,Urubu-Kaapor
1857,korma me mjen ket xwynhje ho  ne me nhum jejus ari me inhma kaper ne me inhma: —ne me ate tirtum kot amnhi nhipex o me apa xwynhjaja ker ka me akupyn amnhi wyr ixkam ajamak rom ne ri apa nom me kep tirtum pram nokati xwynhjaja koja me akinha am htyx tanhma amnhi to pix kukama hamaxper o pa te korma me mjen ket xwynhjaja kot amnhi nhipexta pyrak e pa me ama tanhma me harenh to ka me inhma koja korma me mjen ket xwynh kep jaja ma hkramnhwy mjen ma xwynh kuta pry ha mra amnhi kot kane jamy ne o mra ne kutep pry nhikrep hkri,Apinayé
18472,jose va'ora kaboa'iha adani kidiabi'i jaco igamina vihiki afohahavi vikhana kidiania vahojara kaimoni egito kaarabonia  vihiki vaipohina adani jaco kaija'ari kohana oniaroa avikhaha adani jaco kidisai vaipohiki khama egito kaarabonia vahoja'aha badara ipohiki vahoja'aha na'arihavi vihi'ina adani jaco kidisai hahavi vihiki vaabini'aha afohanana vaabinihanana'aha vaba'ona-ra avisanana'aha vakadika'damahi ibavini siquem oniki kania abraao kohana hokina kari bikapavakariki ida ja'di hodijama'oki vakadika'damahi ibavini kaimoni emor kohana kahanodi vakadiania,Paumarí
4687,umuhamuhaz maꞌeaꞌyz oho oko pe kury amo maꞌeaꞌyz uꞌar pe rupi naꞌe wiramiri uꞌu paw rupi wa,Guajajara
12,kowenu omipona pyra kuahtao xine ritonopo nymenekatya omipona pyra sytatose morara exiryke kowenu omipona pyra exiketo wanohnoko ma toto,Apalaí
5885,haꞌe vaꞌe ojekuaa uka eꞌy mbove  ranhe israel kuery haꞌe javive pe omombeꞌu oikovy jajeko rerova vy nhanhemongarai uka agua regua,Guarani
615,tuaro pyra exiketo maro awahtao xine ekurehpyra ehtoko amorepatoko toto ritonopo omiry poko tuhke iirypyrymako nae exiryke,Apalaí
18160,gama'aha bikaabani'ihi ida sirisiriki komini kihiki jesua bini'ahi: —radaha'aradaha'ihi ida sirisiriki karadaha'ihi jaboni ida komini kana'bahaki ipohina-ra va'ora kani'a'aha: —niha avakhanimanija avaofiniki deu-ra vavakaijoka bana avakajari'damanija ida deus a'onira akadava'avini,Paumarí
22232,koeku yexi itukeovo koati ponovoti kixoku itukeovo ne kristu konokoatimo yexi itukeovo iko'inamaepomaka kristu ne uha koeti xane ponovoti kixoku itukeovo,Terena
9604,upei petei tei ogwahe ou-vy hovagwy-py imboete raꞌanga anga-vy ou hovagwy-py —toiko are katu toiko are katu judeu ruvixagwasu heꞌi onhembohory-vy hesu-rehe ohovapete pete ixupe,Kaiwá
19069,nao se ponham em jugo desigual com descrentes pois o que tem em comum a justica e a maldade ou que comunhao pode ter a luz com as trevas,Portuguese
26791,nhym kum —‍badjwy me'oja kaben ma ane nhym kum —‍ge akatima ga kam arym kaben ma ane,kayapó
24754,chaymi malca-masincunapis manapacuyata licacunapis: “manachun wicchu tacuylla tacul manapacu aplaca” nipacula waquinninmi “paymari” nipacula juccunanatacmi “manam jucmi paynu-nilalla” nipacula aplanatacmi: “quiquimari caya” nila,Urubu-Kaapor
1250,a tawija tirtum kot kris ma kaper jarenh ne kep o pahi ha kaga ane me kajaja na ka htem am kep tawi tamnhwy pix a axpen ma harenh o ri apa no ket tawija na pre kep o pahihti ha harenh o pa ane,Apinayé
16301,nxe³­yan¹­ta¹­ ka³­ten³­su²­ hin¹­sxa³­ yxau³­na¹­kxai²­nan²­tu³­ wi¹­kai³­a¹­ju³­ta³­nu³­a²­ yu³­tu¹­wa²­ nxe³­na¹­ha²­kxai³­ ih¹­nxe³­nah¹­lxon³­ku²­ ka³­ten³­su²­ yxau³­na¹­ta³­nxa²­ ya³­lu²­na¹­ta³­nxa²­ nxe³­hi³­na¹­te²­la¹­ku²­ nxa¹­nha²­wa²­ ju³­tha¹­li¹­ i²­sxa³­ sa²­so¹­na¹­ju³­ta²­ yu²­na³­la²­ txa²­hi¹­nxai³­la¹­ju³­ta²­ a³­na¹­sxa³­ kris²­tu³­jah¹­la²­ yxau³­ju³­ta²­ a³­wi¹­hu³­ha¹­ju³­ta²­ ten³­khaixsa³­nha²­wa²­ wi¹­kai²­no³­nhi³­nxna³­la²­,Nambikuára
18628,papira roaroaki akarani ahoaranini hoariha aniani hari oniaroa deus ibavia onokiha ada ovilia dorona oniki papira roaroani hoariha akarani-ra anivini biarabikhai'ianaki ida ahoaranini,Paumarí
15762,be raganado ba be ahom sa mahanh sa panang ba naa be ahom ba be tsyym suun be tepyng padag kꞌaats tii da be badꞌoo rabahapah hyb nꞌaa dooh baad tado ba pꞌop haga do panyyg raky nadaheeh doo —nang ma ta kyyh sa ha,Nadëb
17740,jesus aotyakijita aiyatelikihitita xoaha hatyaoseta jesus exoaheta tyairi henota ekakoaha hoka amematyoa kahare haxaotyakiraharenai kakoa hakakoehekoare hoka kahare halitinai nali tyaonahitaha judeia koa nalitarenai jerusalem nalitarenai wenakalatikoanai tiro sidom xoaha one kaloxere haliya tyaonitere nalitarenai harenai tyoaha semaha maheta jesus niraene exahe kaxaiyatelikisakehenahitaha maheta ekahehareha nonitata haiyanai isekohaliti iniyalahare hasakaharetiterenai tehitiya tyoaha hoka waiye maniya kaxomokakehenahititaha tyotyaha kasani ekaokakisa hakahe ihiye aokowiyahitaha ihiyeta iyateliti hikoita hoka aiyatelikihitita tyotya halitinai hoka,Parecis
14413,— “ibu'u'uat en” cekariwa o'e “ikereat kug en etaybit tu warara'at ekat pewi ojat iam wekapikap'umat pewiata otabu iam etaybit tu imen etaybit pima wedinheiro'a eyaum cuy dinheiro'a muxipanpan'ukat pe wara'at dinheiro'a bu am owebeam” io'e “wepit puje eyaum kuka owebe” io'e,Mundurukú
6914,niɡijo naɡa noditicoaci niɡijoa liiɡexedi joao odaa jesus ja yalaɡate joao meetediogi niɡica oko “niɡijo neɡemiitiwaji akapetege  midi nipodigi ane yadilo ane diɡica niɡeladimigipi amiini ica anemii awinitiwaji ejideɡemiitiwaji mawini ɡoneleegiwa aɡamaleɡegi ane diɡica baɡa lowoogo micataɡa niɡina naanyogo ane igiketibece niocodi enice amiini ica anemii awinitiwaji ejideɡemiitiwaji mawini ɡoneleegiwa liico ane dinixotinigilo nowoodi libinienaɡa ane dakake loojedi niɡina oko anodinixotinigilo nowoodi libinienaɡa ane dakake loojedi odiɡeladetigilo diimaɡa nelecoli liɡeladi ɡoneɡaɡa enice amiini ica anemii awinitiwaji ejime emii mawinitiwaji anigepidiɡijo niɡijo anoyeloɡoditedibece lowooko aneotedoɡoji odaa ejitaɡawatiwaji niɡijo anemii awinitiwaji daɡaxa me ɡoneɡegi caticedi niɡijo anoyeloɡoditedibece lowooko aneotedoɡoji,Kadiwéu
11864,aꞌeramu jejui ꞌga awau kanapeꞌi pyyka imowowoka imua oree pira eyra reewe oferaw ire futat jejui ꞌga poromu ojesaukaruꞌjauꞌjapa oree kwaiwete ikue poromu futat ore upe ꞌga jesaukara muapyra,Kayabí
3585,konokuze kula “deus itaumbyry egatuim xina” kewani modo jesus aguely: — tonomeguela itaunga “deus itaumbyry egatuim xina” kewani modo aga udodo kaneru xuhudugue azetydadyby emyenro kula akaemo,Bakairi
21912,miꞌi hawyi taꞌa­tunug naꞌyn iꞌe hap ewy hawyi apyk puo tukup­teꞌen,Sateré-Mawé
19036,entao ele o chamou e lhe perguntou: ‘que e isso que estou ouvindo a seu respeito preste contas da sua administracao porque voce nao pode continuar sendo o administrador’,Portuguese
14574,ibo o'jebapuk apen deus ekawen muwenuwen'ukat o'e iap tag- -apen  kuyje o'e iap tag,Mundurukú
15645,—pꞌooj ub y na-aaj he sa da hadoo ne paa yyh ti noo go ha y tawꞌaats he sahonh he y hajaa doo me y karen y rejaa jesus nasareh buuj had tii dꞌ ne paa y badꞌoo jerusarenh ba pꞌop haga do tob nꞌaa yt ha moo hebꞌooh do sa wahe nꞌaa kyy go hajok jesus ha hꞌyy kaꞌeeh do y dewats bꞌeeh radejeeb ba y karen ne he paa radejep,Nadëb
2228,kitxakapirika aatokirini xakoo sikaua ate ia aariko iua imiakori ipiraakori pakini iatari ia aparaa ia aarikoakiri pite apiata atxiiti —otxa,Apurinã
24970,niyculuptinmi: “taytay diospa willacuninpischa cayanqui,Urubu-Kaapor
6318,icoa fariseutedi odipokotalo jesus meote ica ɡodoxiceɡedi icoa fariseutedi igotibeci midoataɡa jesus odaa jiɡidaaɡoyatigi modinotigimadetege odineetalo jesus joaniɡidaa leeɡodi modipokotalo meote ɡodoxiceɡedi ane ikee mida nimaweneɡegi aneotedoɡoji midoataɡa,Kadiwéu
1670,ne korma me pahte jejus kot amnhi xunhwyr ket ri na pu prem me panhiget pyra ne pahtyx ri amnhi tomnuj o ri papa ta nhum krisja te amnhim me pajapror pyrak o me panhipex me pahte hpanha kaper kot pix ma amnhi nhipex o papa kaxyw no memoj to na pre me pahpanha amnhire na ra me pahte ja jarenh mar tyx na pre kaxpore ho me pahpanha amnhirer ket ne ry or o me hikukrex a ohto ho me pahpanha amnhirer ket ne ry prat o me hikukrex a ohto ho me pahpanha amnhirer ket ne jajaja hapex tokyx anhyr ma xwynh na na pre a me hpanha amnhirer ane ne tam me pane ty ne htyk o amnhi nhi ho me pahpanha amnhirer pa nhum hkamro axkapi te amnepe ma me panhiget kot amnhi panha tirtum ma owehti hkrare hpar nhum hkamro pikapirta pyrak owehti krare mexre pix na prem kam kupa mex ne tanhma kute hket xwynh pix ta krisja aa tanhma amnhi tomnuj to hket kumrex ne me pane ty ne htyk o tirtum ma me pahte amnhi tomnuj piita hpanha amnhirer pa,Apinayé
11801,mamaꞌe tywera apoara ꞌga jarejuwarete ꞌga jeꞌega rerowiareꞌema futat ajemogyau aipo ꞌga futat itywet jarejuwarete ꞌga upe ꞌga jeꞌega renupareꞌema ꞌga itywetywet ꞌga upe,Kayabí
16710,nxe³­nu²­la²­ a²­yen³­kxa²­ a²­nu²­su²­ ta³­nxa²­ ka³­yxuh³­sxu²­ ta³­nxa²­ txa²­wa¹­su³­na²­ ka³­ten³­su²­ i³­yutsi¹­kxa²­ a²­yxo²­ha³­kxa¹­ i³­ye³­kxain¹­na²­he³­la²­ oh³­xai²­nan¹­tu³­ka³­txa²­ a²­yxo²­ha³­kxa¹­ yuh³­xai²­nan¹­tu³­ka³­txa²­ a²­yxo²­ha³­kxa¹­ txa²­wa¹­ha³­lo²­a²­ yuh³­xan¹­ko³­xan²­tu³­ nxe²­ yxau²­xai³­tu³­ka³­txa²­ a²­yxo²­ha³­kxa¹­ i³­ye³­na²­ kain²­je³­na²­ yxau²­xai³­tu³­ka³­txa²­ a²­yxo²­ha³­kxa¹­ i³­ye³­sxa³­ sa²­nen¹­kxain¹­te³­nah¹­lxi¹­: — jah¹­lai²­na²­ a³­wxe³­ka³­lo³­ai²­na²­ hxi²­kan¹­ta²­ si³­yxau³­jah¹­lai²­na²­ a³­wxe³­ka³­lo³­ai²­li²­ a³­wxe³­jah¹­lai²­na²­ sa²­kxai³­lu²­ wi¹­lhin¹­khaixjah¹­lai²­la¹­wi¹­ o³­ve²­a²­ wen³­su³­jah¹­lai²­na²­ wi¹­lhin¹­khaixjah¹­lai²­la¹­wi¹­ i³­wi¹­lxo³­kxain¹­ki³­ju³­ta²­ wai³­nha²­kxai³­ i³­sa²­nen¹­kxain¹­ki³­ju³­ta²­ wai³­nha²­kxai³­ i³­wxi²­kin³­ti³­ton³­ti³­hi¹­tain¹­ki³­ju³­ta²­ wai³­nha²­kxai³­ ha³­lo²­a²­ whai²­na¹­ i³­hxi²­kan¹­txi³­lo³­te³­ya³­nhe³­ju³­ta²­ wai³­nha²­kxai³­ nxe³­sa²­te³­ki³­ya³­nhe³­ju³­ta²­ wain³­na³­li¹­ hai³­txi³­ ta³­lu²­nhxa³­ki³­sxa³­lho³­li¹­ nxe³­ain¹­na²­he³­la²­,Nambikuára
25918,'re ihaimana u'asi mono ha dure wanhib'apito zezusi ha aima waihu'u pese za'ra wa'aba di ane wa wa ai'ama tama 're imreme u'asi za'ra wa'wa isimizawize ha ai'ama 're haimana u'asi za'ra wa'aba mono da dure rowe u'asi ama 're anomro u'asi aba mono da,Xavánte
20727,niytahi bijoikpe iknykta babyita tu hokda zuba niy batu ity nyzo iwaze koronerius harakykbyi hi tatsumuehitsa bo huahua niy petoktsa sitsumuehitsa iwahoro eze tarabaja ziknakaranaha usta sodadu atahi deus humo tispirikporeta iwaze sibo nipamykysoko ana hi bijoikpe iknykta ibo nitsasoko atsatu sibo nitsasoko iwatahi sopa bo nisipehahik iwaze kytsa harakykbyi sopa bo nitururuknaha,Rikbaktsa
561,morarame osemazuhme aepyhpyry tomose roropa moro eneryke tyya jezu esematopopyry tonetupuhse eya —to tosemase ropa nae tykase tyya rokene ritonopo omihpyry poko tuarotara ro toh kynexine jezu esemamyry ropa poko aorihxipo,Apalaí
22936,ina kixovokoxoa jesus: —‍noinjoa ne satanae kuti koeti ipixeneneoti irikovoti ukeati vanukeke,Terena
12330,jesusya yuukuꞌpi: —asakiꞌne miaꞌ pona tiimoꞌtai kaisari tauya pepin tiise tuꞌke iteꞌka kaꞌki  kaisari kaꞌki —taꞌpi jesusya ipiꞌ,Macushi
20964,— ikiahatsa tihi: “aty deus bo motsaso zeka ‘anaeze myraratsa wezowy eze deus bo nyny tsimaha anaeze deus wahoro zubata eze tu kaharere wasani my’ iwa motsaso zeka iharere wasape ja batu myhyrinymyry” ata tihi zeka “o myraratsa ty hi atakta deus bo nyny my zeka iharere wasani my” ana humo myhyrinymyretsa,Rikbaktsa
17760,— xaotyakisatiye aokitene haomana hoka — nexaha,Parecis
10503,ijo ityhydyyduo idi rybe jei jeina‑ki ratximyhyre tule tai ohote ryire reruti ohote‑di tule ijo womati reroti‑di rataataare ihyymy idi rehure rotenawo‑o,Karajá
2383,txamari xotasi isikariotxi inakori apokaerekatari kamariaro xesosi kitia okitakini iua xotasi simao akiri xesosi moianari itxaua txamari imikapiritariko xesosi ininia xotasi txari: —kakiti parikauata tresetosi pakini oti oia atoko inakaro kamariaro iamotiko ikapani kinirepa kona ovetxitaaka kinirepa txineiro mauakinitimoni osika —itxa xotasi,Apurinã
274,morarame jezu a tozuhse toto —azahkuru matose ritonopo omiry waro pyra oexirykoke ijamitunuru waro pyra roropa oexirykoke aorihtya to esemakary ropahtao pytara exino mana niotara roropa nohpo tomo enara ritonopo nenyohtya sa roke exiko ma exino,Apalaí
21149,pyno saꞌa­wyꞌi so wetup tawa piat toineꞌen morekuat esurara akag koro iꞌatuꞌe miꞌi miit topy­huꞌat morekuat muꞌe hat uwe waku uwe yt naku i e hanuat iꞌatuꞌe e miꞌi miit maꞌato ti yt tupana mohey hin i hat iꞌewyte yt toiꞌa­tu­kyꞌe hin i miitꞌin iꞌatuꞌe so e,Sateré-Mawé
4286,amo maꞌe amumeꞌu putar peme ihe nehe kury zawaiw katu kawaru kupewaꞌa heixe haw aguz kwar rupi aꞌe zawaiw katu weraꞌu hemetarer katu maꞌe tupan hemiruzeꞌeg romo heko haw aꞌe,Guajajara
25333,tawamha zezusi te dure asa tama nhari za'ra: — wa ha ipire na isina 're iwata mono o di ipire na isina 're iwata mono 'wa'aha are dama iwapure di imama si te ipire na te te dama 're iwasu'u ta ha asib'apito na te 're isisi za'ra wa'aba mo 're ihaimana u'asi mono ha,Xavánte
26174,gwaj bakamy onemudjwy dja ba ano wam ar ro'a ar ano gwaj bama onemu jabekumrex tam dja ba ano nam amim kritu markumrex ne kanga ket ar ajo 'o be ar ta dja ar ar ama jakam myjja kuni jare,kayapó
3111,aguely adaguho ura  xira iweninri deus kywymary jesus cristo wara emary ura idanara deus eynynonro modo kaendaenkuly tainkonro modo lelaba,Bakairi
14836,— “ebiogbuk cuy eguju okay itabucayu kay” i oce'e cebe- -webay be — io'e jesus — ixe gudot eybuywatwat'ukan ixe iceman e'e'ukat ixe ma omuwen eywebe — io'e,Mundurukú
11002,aipo renupa taetu piratu ꞌga jejui ꞌga wi opoir are afueweramu —apoit je ꞌga wi— ꞌjau ꞌga ꞌga nupe aꞌere ꞌga ꞌi etee piratu ꞌga upe: —ꞌga wi epoir ire nipo naroma ywy pewara ꞌga ꞌwyriara ꞌga jekotyꞌaawa rui ereko— ꞌjau ꞌga wafukaita ꞌga upe —“je futat ꞌwyriararetea” eꞌi te ꞌa jejui ꞌga oree aꞌeramu ꞌga akou janeꞌwyriara ꞌga ree iporomutareꞌemamu aꞌeramu nipo janeꞌwyriara ꞌga sesa ꞌga amaraꞌneramu ene ree ꞌga wi ene poiramu— ꞌjau ꞌga wafukaita ꞌga upe,Kayabí
12620,moropai jesusya taꞌpi toꞌ piꞌ: —moises nuriꞌti nitiriꞌpi pepin miriri penaronkon yuu ton ˻tiise miriri paapa nitiriꞌpi˼ tiise uyun nitiri siriripe aapiaꞌnikon yairon ayukon ton kaꞌ poinon miriri ayukon ton paapa nitiri iipi kaꞌ poi moropai enen tiikoꞌmantoꞌkon ton tiriiya siriri non po tiikoꞌmansenon pia,Macushi
15209,ti ta kariw nꞌaa ky hadoo ta ha: “ahom panang bahanh sahonh mawꞌyyt do matsyyd y karen top y gabadꞌee dak baad y herꞌoot a ha pooj je katsyyd bong doo dooh da y anꞌoo ba sa ta dooh y anꞌoo ba sa waa” nang ta kariw nꞌaa kyyh pꞌop haga do bagꞌaas do jam nꞌaa henh ji pꞌop haga do batsꞌyyt do ky nꞌaa hahyyh —nang ma jesus sa ha,Nadëb
7006,ga repiagame ovelhas repiakatuhara'ga imombe'umbe'upavi tupana'gapyrive'ga nhi'iga —‍“belem me pepojykaharete'ga cristo'ga ari pembopiro'yharamo” ei ga tayri'ga mombe'gwovo ei ovelhas repiakatuhara'ga onhimomby'a pa ga – kiroki ga gwendu ganhi'iga,Kagwahiva
23734,jesu pɨara kɨɨ bu'esere siru tuu'karare bahua'ke nii' jesu maria madalenare bahuaka be'ro apera pɨara kɨɨre eho peorare bahuakɨ niiwi taha naa kapupɨ siharare kɨɨ api weero noho bahugɨ bahuakɨ niiwi,Tukano
20364,niytahi peduru ustsa sakzohotsa tuk siharere soho nipamykysoko peduru ispe niy: — katsaktsa deus harere bo hyy tsimykaranaha kytsa harere meky watu zeka batu hy tsimaha,Rikbaktsa
25531,tawamha apito pesitu ha te asa tama tinha: — e zeruzare u aimori da ha aima we di tame da te asadanhari za'ra da inho'a — ane te sadanha zudezu nori ma imreme te te tama ama uwaimrami za'ra da tama irowe za'ra zeb da,Xavánte
18561,ki'daraha'aha ida ija'ari athi-ra kamithaki bianathoranihi ida makari fori hiki vinho kaidivarikia ava oadaki sanarahakia binahoja'ihi bivikhahi jesus viaha biarakasihi jesua binadomidomija kaimoni ida vinho a'bani ava akasanakhamaki kania ija'ari-ra va'ora ni'aha ada vinho-ra vikhaki: —hari'a kaho ada kaho vahabini khaha elias ava akasanakhamakia biakava'ijoara kaimoni ada jesus vada ani'ava,Paumarí
7718,—‍tiruahu ti pe me a'ereki pe peapo katu tehe tapyja aheryvya rehe tupana'ga nhi'iga mombe'uharava'ea ryvya rehe ymyahu penamonhava'ea tupana'ga nhi'iga mombe'uharava'ea jukai pehe peapo katu aheryvya jukwaha reki ahemanoa pyryvamo pe me a'ereki pe napehendukatui imombe'uharava'ea nhi'iga no ei jesus'ga —‍nura ymyahu tupana'ga reaporogitaro ga e'i: “amondouka po ti ji ga pyri nhinhi'iga mombe'uhara'ga nhimoiruhara'ga ndeheve nehe jara'ga po ti ga ga jukai nehe nhinhi'iga mombe'uhara'ga nhimoiruhara'ga ndeheve nehe jara'ga po ti ga ga monhani okote'varuhuavo ga pe nhinhi'iga mombe'uhara'ga pe nhimoiruhara'ga pe nehe no ogwovo ga ndeviri nehe” ei tupana'ga ymyahu ei jesus'ga,Kagwahiva
4193,— aze teko upuranu penehe nehe — marazawe mehe pekwaraw putar zumenaꞌyr pe aze iꞌi peme nehe — zanezar uputar aꞌe peze izupe nehe iꞌi wanupe,Guajajara
8506,vasy ajag tog ty tope vi mranh jafa ja nytigti ha ra ajag tog uri tope vi kri fig ti ha ajag fe ty ti ki ge ky ajag ty tope vi me ja en kri fig ajag tog ti ky sog tope my vi ha han ti ajag to tope vy ajag jykre kugrynh ajag ty ty ti vi mranh jafa tu nyti je uri ky ajag tog ty tope krem ke nyti ajag ty ty ti jykre kuryj mi mu jafa nyti je uri,Kaigáng
25950,— ate ni'wam nori ha te za tare te te aima 're rowasu'u za'ra wa'wa ane: “danho'reptui'wa da 're ihaimana u'asi mono te te ipisudu ha ma to wei mo apa ohota te nhamra a'ubuni wi” ane ha 're wapari za'ra wa'aba mono wamha a'ubuni u 're anomro aba mono o di za izo 're asopre wa'aba mono da ate te za dure ane da te aima 're rowasu'u za'ra wa'wa: “ahata ma dawi aima'u” ane wamha ama 're dazaze za'ra wa'aba mono o di za senai'o na ha wa ha pi'uriwi nimaha na ha za we apa imori o na da'asina,Xavánte
16005,nxa²­ha¹­te¹­ kxa³­nhxi¹­nu¹­tai²­na²­ i³­sa³­e²­ nu³­ka³­txu¹­tai²­na²­ nxe³­ta¹­hxai²­he¹­la²­ nxe³­te²­nau³­xai²­na²­ wa³­la³­ka³­txa²­ si³­na³­i²­ka³­txa²­ a³­ti³­sxa³­ yxau³­ain¹­ta¹­hxai²­he¹­la²­ a²­nxe³­ka³­txai²­na²­ sa²­kxai³­lu²­: — wxa²­wxai³­yah³­lxi³­txa³­he¹­li¹­ txa²­wa¹­su³­nu²­kxai³­lu²­ nxe²­ kwa³­na³­kxain¹­ta¹­hxai²­he¹­la²­ nxe³­nu²­la²­ txa²­wa¹­su³­na²­ a³­ka³­nxi²­kxai²­nan²­tu³­ wa³­lai²­na²­ a²­ne³­ka³­nah²­nau³­a²­ ha³­nxe²­a²­ kain²­ i³­ha²­kxai³­ ha³­lo²­a²­ yxo²­ha³­kxa¹­ kain²­ ka³­nxa³­hi²­ha²­kxai³­ nxe³­ta¹­hxai²­he¹­la²­ nxe³­ju³­tan¹­te²­kxa³­ya³­lhu²­ a²­nu²­a²­nau³­xu¹­tai²­na²­ i³­yuh³­lxain¹­ta¹­hxai²­he¹­la²­ nxe³­sxa³­ itta²­ waun³­txa²­ i²­ah³­lxi³­ha²­kxai³­,Nambikuára
25010,wa'ubure ha wa'rui'wa ha ropoto na'rata hawim hare te tiwasede ha te te 're ab'manhari u'asi taha wa ni'wam nori ha tiwasede te te 're 'manhari u'asi za'ra mono wamha ta nori ha wa'ubure nhib'a'uwe te 're haimana za'ra taha nhimiromhuri wasede ha te te tiwi pari da ma to 're ihaimana u'asi mono 'ra ha we ti'ai u dateme mo,Xavánte
8958,kejen tog: “uri ha sog ki kanhro ni ha sy nen han ke ti” he mu “sy tag han ky ag tog iso ha nytinh mu ky ag tog inh my: “inh mre ninh katig” henh ke mu inh patrao ty inh fon kar ky” he tog mu ti camarada koreg ti,Kaigáng
26386,nhym kam arek koritukam mema metindjwynh kaben jarenho ba nhym arym 'a amex ne 'a nan ajte 'a amex apex,kayapó
21943,motꞌi eweikup­teꞌen iesui mohey haria pytkai — urumuꞌe i ro eweiꞌe yn yt uruikuap i te ti urumuꞌe hap tupana eha etiat eweiꞌe at kaꞌap haria eipe are pai koitywy ti waku raꞌyn miitꞌin muꞌe haria wo eweikup­teꞌen maꞌato ti yt itag i te tupana ehay kuap hap etiaria eiperia are miꞌi hawyi ikuap perup i haria eweikup­teꞌen miꞌi pote miitꞌin mimuꞌe wo te neꞌi eweikup­teꞌen miꞌi pote — uruiwaure raꞌyn saꞌa­wy­ꞌi­tewuat urumuꞌe hap e haria wo eipe miꞌi pote urumuꞌe i ro mehi mana mekewat saꞌa­wy­ꞌiwuat sehay tupana etiat ehenoi i ro uruepe eweiꞌe aikota hirakat ihire te rakat ewy eweikup­teꞌen tupana ehay kuap hap ete aikota aimepyt hit yt tenuk kuap i iheg kahato rakat ete hap ewywuat kahato eweikup­teꞌen tupana ehay u hap ete aikota aime­pytꞌin mi hy yn ikyꞌesat hap ewy eweikup­teꞌen tupana ehay miꞌu puꞌi ewywuat u hap ete yt eweikuap kuap i niatpo rakat saꞌa­wy­ꞌiwuat tupana ehay etiat kurin kurin eweikuap aimepyt ihup te rakat ewy mi hy yn toisym kuap ewywuat eipe katu­pono yt eweikuap i te kat koꞌi kat koꞌi som sio pywuat sio yt pywuat i hap sio waku watunug sio yt naku i watunug e hap katu­pono tupana pywuat hap yt eweikuap i te sio waku sio yt tupana e hap yt eweikuap i te pote maꞌato nagnia hai rakaria ihaite rakaria tutuꞌu kuap kahato ipuꞌi kaꞌa iheg nakat ihainiaꞌin hary­po­riaꞌin — toꞌiro watenuk iꞌatuꞌe aimiꞌu raꞌyn iꞌatuꞌe miꞌi hap ewy tupana ehay miwan miat kuap haria ihaite rakaria iesui mohey haria tupana ehay kuap kahato rakaria tikuap kahato kat som waku watunug kat som yt naku i watunug hap koꞌi tupana e hap miwan miat pyi miꞌi haria tupana nug haria teꞌe­ro­py­huꞌat taꞌa­tue­haite imohey hap etiano miꞌiria miꞌu puꞌi u haria ewy are,Sateré-Mawé
